<?xml version="1.0" encoding="utf-8"?>
<!-- edited with XMLSpy v2010 (http://www.altova.com) by Chen Jiangyong (Baison) -->
<tk:Toolkit version="5.0" xsi:schemaLocation="http://www.qdocuments.net ..\..\schema\v5\EasySearch.xsd" xmlns:tk="http://www.qdocuments.net" xmlns:xsi="http://www.w3.org/2001/XMLSchema-instance">
  <tk:Tk5EasySearch DataXml="UserManager/User.xml" RegName="USER" Author="YJC" CreateDate="2014-07-12" Description="用户"/>
  <tk:Tk5EasySearch DataXml="UserManager/Part.xml" RegName="PART" Author="YJC" CreateDate="2014-07-12" Description="角色"/>
  <tk:Tk5TreeEasySearch DataXml="UserManager/Organization.xml" RegName="ORG" Author="YJC" CreateDate="2014-07-12" Description="机构"/>
  <tk:Tk5TreeEasySearch  DataXml="UserManager/Function.xml" RegName="FUNCTION" Author="YJC" CreateDate="2014-07-12" Description="菜单"/>
  <tk:Tk5Level0CodeTableEasySearch TableName="CD_SX" RegName="SX" Author="YJC" CreateDate="2014-07-12" Description="地区" DisplayNameExpression="{Value} - {Name}" >
    <tk:Level>2</tk:Level>
    <tk:Level>2</tk:Level>
    <tk:Level>2</tk:Level>
  </tk:Tk5Level0CodeTableEasySearch>
</tk:Toolkit>
